review,rating,date,clean_review,polarity,sentiment
very irritating. censors free speech and negativity. quit showing political pins and pins of face diapers. reporting every pin i see that is political and face diapers. tempted to uninstall.,1,2026-02-28 20:15:51,very irritating censors free speech and negativity quit showing political pins and pins of face diapers reporting every pin i see that is political and face diapers tempted to uninstall,-0.03,Negative
it works amazing i really like this app and there are so many things you can do,5,2026-02-28 20:09:12,it works amazing i really like this app and there are so many things you can do,0.43333333333333335,Positive
"This is a So super🌸 App,I'm the pinterest girl🎀.Pinterest girls are:Shiny✨️,Glow up🎀,talented👸🏽🎧",5,2026-02-28 19:49:02,this is a so super appim the pinterest girlpinterest girls areshinyglow uptalented,0.3333333333333333,Positive
the best app ever 😎🇨🇮💥,5,2026-02-28 19:44:36,the best app ever ,1.0,Positive
I like the content,5,2026-02-28 19:20:37,i like the content,0.0,Neutral
always stir me most interesting people's and females,5,2026-02-28 19:15:11,always stir me most interesting peoples and females,0.5,Positive
awesome very perfect app for me thank you for making this app i really like it woooh💗,5,2026-02-28 19:07:52,awesome very perfect app for me thank you for making this app i really like it woooh,0.7333333333333334,Positive
lots of help for cooking and crocheting and all kinds of help love pinteres,5,2026-02-28 19:02:11,lots of help for cooking and crocheting and all kinds of help love pinteres,0.5,Positive
I love,5,2026-02-28 18:56:21,i love,0.5,Positive
"I miss the old Pinterest. Hardly any ads now you get mostly ads and hardly any pins. Also, I had to block my profile from public because people would report things not reportable, but Pinterest doesn't actually review it they just take the pin off. Any pins it mostly links to somewhere else. It's not the same. I'm deleting it.",1,2026-02-28 18:45:33,i miss the old pinterest hardly any ads now you get mostly ads and hardly any pins also i had to block my profile from public because people would report things not reportable but pinterest doesnt actually review it they just take the pin off any pins it mostly links to somewhere else its not the same im deleting it,0.06458333333333333,Positive
excellent,5,2026-02-28 18:42:12,excellent,1.0,Positive
Love Pinterest very informative,5,2026-02-28 18:40:17,love pinterest very informative,0.35,Positive
good fun,5,2026-02-28 18:36:43,good fun,0.5,Positive
"all this AI everywhere! I'm sick of it, even now they have an AI running everything. you'd think they'd opt out of the AI trend as most of their users are artists but no, that slop tastes too good to pass up.",1,2026-02-28 18:32:19,all this ai everywhere im sick of it even now they have an ai running everything youd think theyd opt out of the ai trend as most of their users are artists but no that slop tastes too good to pass up,0.16190476190476188,Positive
very helpful and useful app,5,2026-02-28 18:23:48,very helpful and useful app,0.25,Positive
"I enjoy looking at craft and cooking ideas. Gardening, leather work, survival tips. so many topics and no opinions.",5,2026-02-28 18:14:36,i enjoy looking at craft and cooking ideas gardening leather work survival tips so many topics and no opinions,0.45,Positive
idk,1,2026-02-28 18:06:26,idk,0.0,Neutral
i love it i have soooo many things because of Pinterest i really request if you need for decorations,5,2026-02-28 17:59:47,i love it i have soooo many things because of pinterest i really request if you need for decorations,0.39999999999999997,Positive
Teri maka bhosra,4,2026-02-28 17:51:27,teri maka bhosra,0.0,Neutral
cooooool app,4,2026-02-28 17:39:06,cooooool app,0.0,Neutral
یک برنامه خیلی عالی است,5,2026-02-28 17:39:01, ,0.0,Neutral
you could never take me away from this app 😝 I've found ny style bc of it!!!!! 💋🙉❤,5,2026-02-28 17:31:44,you could never take me away from this app ive found ny style bc of it ,0.0,Neutral
شخه من عشره بجد,1,2026-02-28 17:23:00, ,0.0,Neutral
it's good 💓,5,2026-02-28 17:19:48,its good ,0.7,Positive
ihjgurr,5,2026-02-28 17:18:48,ihjgurr,0.0,Neutral
I use this app alot.,5,2026-02-28 17:13:52,i use this app alot,0.0,Neutral
I spend way too much time here.,5,2026-02-28 17:12:34,i spend way too much time here,0.2,Positive
Good 👍😊,5,2026-02-28 17:10:52,good ,0.7,Positive
Aplikasi idiot gw ga ngesaved jadi ke saved sendiri. Giliran mau gw apus gabisa bikin salah paham orang aja bug lag segala macem idiott,1,2026-02-28 16:57:00,aplikasi idiot gw ga ngesaved jadi ke saved sendiri giliran mau gw apus gabisa bikin salah paham orang aja bug lag segala macem idiott,-0.8,Negative
"I love it, I can find all the things I need and love! like FNAF and more.",5,2026-02-28 16:55:07,i love it i can find all the things i need and love like fnaf and more,0.5,Positive
pinterest is so help full,5,2026-02-28 16:44:17,pinterest is so help full,0.35,Positive
The Best Just Love Love Pinterest,5,2026-02-28 16:40:06,the best just love love pinterest,0.6666666666666666,Positive
GREAT APP!!,5,2026-02-28 16:30:09,great app,0.8,Positive
nice app,5,2026-02-28 16:28:01,nice app,0.6,Positive
Good App,5,2026-02-28 16:25:27,good app,0.7,Positive
Life is not easy,5,2026-02-28 16:09:51,life is not easy,-0.21666666666666667,Negative
सुपर सतरा,4,2026-02-28 16:08:59, ,0.0,Neutral
good,5,2026-02-28 16:02:12,good,0.7,Positive
nice,3,2026-02-28 16:00:47,nice,0.6,Positive
My Choice App My Favorite App,5,2026-02-28 15:58:30,my choice app my favorite app,0.5,Positive
best app 😊🇮🇳,5,2026-02-28 15:53:25,best app ,1.0,Positive
I hate this app,1,2026-02-28 15:52:32,i hate this app,-0.8,Negative
"This app is really good other than some adds that look like actual work, it's easy to navigate and overall really good,",4,2026-02-28 15:49:53,this app is really good other than some adds that look like actual work its easy to navigate and overall really good,0.2847222222222222,Positive
very good app,5,2026-02-28 15:46:27,very good app,0.9099999999999999,Positive
"What an wonderful,useful app i like it keep it on. I can't express how wonderful this app is. It feels like a real companion",5,2026-02-28 15:44:27,what an wonderfuluseful app i like it keep it on i cant express how wonderful this app is it feels like a real companion,0.6,Positive
I am an artist and my mood is do drawing I'm come on Pinterest and I got very good drawing options,5,2026-02-28 15:43:20,i am an artist and my mood is do drawing im come on pinterest and i got very good drawing options,0.9099999999999999,Positive
lightweight and smooth,5,2026-02-28 15:39:27,lightweight and smooth,0.4,Positive
so so so good 👍,5,2026-02-28 15:39:15,so so so good ,0.7,Positive
It's a nice app i've ever seen✨,4,2026-02-28 15:35:35,its a nice app ive ever seen,0.6,Positive
Pinterest,5,2026-02-28 15:29:19,pinterest,0.0,Neutral
good,5,2026-02-28 15:27:27,good,0.7,Positive
"The app is best but 3rd grade buffering issues with a network of 5g++, even after update, not at all running smoothly.",1,2026-02-28 15:16:38,the app is best but rd grade buffering issues with a network of g even after update not at all running smoothly,0.7,Positive
very easy to use it,5,2026-02-28 14:59:49,very easy to use it,0.5633333333333334,Positive
Nice,5,2026-02-28 14:58:17,nice,0.6,Positive
best,5,2026-02-28 14:51:42,best,1.0,Positive
i like this ❤️,5,2026-02-28 14:51:01,i like this ,0.0,Neutral
I love pinterest,5,2026-02-28 14:49:33,i love pinterest,0.5,Positive
"n e nuhc["":,; d..",5,2026-02-28 14:46:36,n e nuhc d,0.0,Neutral
very creative!! also encourages many different sites ♡,5,2026-02-28 14:43:40,very creative also encourages many different sites ,0.3833333333333333,Positive
i cant even open the app,1,2026-02-28 14:38:00,i cant even open the app,0.0,Neutral
"I love this app ,I find all sorts of interesting things ✨️",5,2026-02-28 14:37:14,i love this app i find all sorts of interesting things ,0.5,Positive
very most likely app 🎀,5,2026-02-28 14:36:25,very most likely app ,0.325,Positive
Really super app this,5,2026-02-28 14:35:07,really super app this,0.3333333333333333,Positive
very interesting and helpful 😄,5,2026-02-28 14:33:19,very interesting and helpful ,0.65,Positive
the best,5,2026-02-28 14:30:47,the best,1.0,Positive
glup?,5,2026-02-28 14:30:23,glup,0.0,Neutral
the best💐,5,2026-02-28 14:24:24,the best,1.0,Positive
🥺🥰 nice app useful,5,2026-02-28 14:17:59, nice app useful,0.44999999999999996,Positive
Amazing🥰🥰🥰,5,2026-02-28 14:12:59,amazing,0.6000000000000001,Positive
yrr i have only one word for this app dammm......,5,2026-02-28 14:01:38,yrr i have only one word for this app dammm,0.0,Neutral
i helps me a lot,5,2026-02-28 13:49:46,i helps me a lot,0.0,Neutral
thise is best,5,2026-02-28 13:48:13,thise is best,1.0,Positive
Too complex to delete pins,2,2026-02-28 13:39:29,too complex to delete pins,-0.3,Negative
más anuncios que fotos,2,2026-02-28 13:36:54,ms anuncios que fotos,0.0,Neutral
it's good,5,2026-02-28 13:35:12,its good,0.7,Positive
I love it sm,5,2026-02-28 13:25:19,i love it sm,0.5,Positive
🤧✨,5,2026-02-28 13:24:28,,0.0,Neutral
I like it too much because they is everything okay anything is there,5,2026-02-28 13:22:50,i like it too much because they is everything okay anything is there,0.35,Positive
best app I ever seen,5,2026-02-28 13:17:48,best app i ever seen,1.0,Positive
good,5,2026-02-28 13:14:50,good,0.7,Positive
bohot hi accha hai,5,2026-02-28 13:02:21,bohot hi accha hai,0.0,Neutral
I think is very educational as well as entertaining.,4,2026-02-28 12:58:23,i think is very educational as well as entertaining,0.4125,Positive
Of all ages and experience knowledge quantities,4,2026-02-28 12:55:52,of all ages and experience knowledge quantities,0.0,Neutral
I am searching for pictures of LENT but this Pinterest keeps showing me sexual pictures of movie sites. Why will you include such site on holy images? What a shame!,1,2026-02-28 12:47:08,i am searching for pictures of lent but this pinterest keeps showing me sexual pictures of movie sites why will you include such site on holy images what a shame,0.25,Positive
I don't like having to login just to us: Uninstall,1,2026-02-28 12:37:34,i dont like having to login just to us uninstall,0.0,Neutral
good,4,2026-02-28 12:37:24,good,0.7,Positive
اجمل من كل البرامج 💕💖🍯🫀🌺,5,2026-02-28 12:31:49, ,0.0,Neutral
it just want open,1,2026-02-28 12:26:38,it just want open,0.0,Neutral
thankyou yah app banane ke liye,5,2026-02-28 12:17:51,thankyou yah app banane ke liye,0.0,Neutral
ads are more terrible and toxic than the dodgiest ones I have seen,1,2026-02-28 12:01:04,ads are more terrible and toxic than the dodgiest ones i have seen,-0.25,Negative
I always find what I'm looking for,5,2026-02-28 11:51:24,i always find what im looking for,0.0,Neutral
this app is freezing like crazy. I've cleared cache and still freezes. please sort it out?,1,2026-02-28 11:37:12,this app is freezing like crazy ive cleared cache and still freezes please sort it out,-0.6,Negative
Always find amazing stuff and ideas. Great app 👌🏾,5,2026-02-28 11:21:14,always find amazing stuff and ideas great app ,0.7000000000000001,Positive
"if you like to cook and create, this is the app for you. I love it",5,2026-02-28 11:05:37,if you like to cook and create this is the app for you i love it,0.5,Positive
"very unique,useful, Aesthetic and pasavogue💅",5,2026-02-28 11:04:20,very uniqueuseful aesthetic and pasavogue,0.2,Positive
Too many ads,1,2026-02-28 11:03:52,too many ads,0.5,Positive
very poor login problem,1,2026-02-28 11:02:22,very poor login problem,-0.52,Negative
I cant download pics,3,2026-02-28 10:55:38,i cant download pics,0.0,Neutral
I can't get in Pinterest🤬🤬🤬,1,2026-02-28 10:54:49,i cant get in pinterest,0.0,Neutral
love this so much so much idea 😍,5,2026-02-28 10:54:44,love this so much so much idea ,0.35,Positive
I like this app,1,2026-02-28 10:42:16,i like this app,0.0,Neutral
nice app,5,2026-02-28 10:39:03,nice app,0.6,Positive
good experience,4,2026-02-28 10:32:08,good experience,0.7,Positive
I love this app so much I spent lot of my time in it😝😝,5,2026-02-28 10:29:52,i love this app so much i spent lot of my time in it,0.2,Positive
"Pinterest is the best you can look for something to draw , wallpapers, and funny memes and pictures!",5,2026-02-28 10:23:36,pinterest is the best you can look for something to draw wallpapers and funny memes and pictures,0.625,Positive
Why would you involve AI 👎🏻,1,2026-02-28 10:21:56,why would you involve ai ,0.0,Neutral
"Just like a bunch of other users, I'm also displeased with the abundance of ai usage in the app's moderation. This app has been one of, if not the most go-to app for creative's inspiration and the fact that you'd prioritize using something that is actively making them go out of business is disheartening . Besides that, I've reported countless of pins depicting NSFW ai art but they were all dismissed. Comments on pins have also become messed up due to the ai making letters go missing.",1,2026-02-28 10:13:47,just like a bunch of other users im also displeased with the abundance of ai usage in the apps moderation this app has been one of if not the most goto app for creatives inspiration and the fact that youd prioritize using something that is actively making them go out of business is disheartening besides that ive reported countless of pins depicting nsfw ai art but they were all dismissed comments on pins have also become messed up due to the ai making letters go missing,-0.01388888888888889,Negative
Amezing App 🤌🧬😘💯,5,2026-02-28 10:06:43,amezing app ,0.0,Neutral
what experience how to buy n we can't even see the product price,1,2026-02-28 09:50:49,what experience how to buy n we cant even see the product price,0.0,Neutral
good,5,2026-02-28 09:43:27,good,0.7,Positive
like excellent app,5,2026-02-28 09:38:43,like excellent app,1.0,Positive
this app is incredible i really obsessed with this app,5,2026-02-28 09:33:01,this app is incredible i really obsessed with this app,0.2,Positive
so good and beauty,5,2026-02-28 09:32:30,so good and beauty,0.7,Positive
nice app,5,2026-02-28 09:31:12,nice app,0.6,Positive
"Yet another app lost to AI. These mass bans are insane. Who in their right mind would hire an AI company to moderate their app?? It's been a good nearly 2 decades, and I doubt Pinterest will take accountability for all of this, so until they fix their app, which they most likely wont, so long🫡",1,2026-02-28 09:28:49,yet another app lost to ai these mass bans are insane who in their right mind would hire an ai company to moderate their app its been a good nearly decades and i doubt pinterest will take accountability for all of this so until they fix their app which they most likely wont so long,0.0669642857142857,Positive
"every time I try to login with my gmail, it fails. i tried multiple id and multiple times. @pinterest please help 🙏",1,2026-02-28 09:24:43,every time i try to login with my gmail it fails i tried multiple id and multiple times pinterest please help ,-0.16666666666666666,Negative
In this app i learnt how to become aesthetic lifestyle,4,2026-02-28 09:21:52,in this app i learnt how to become aesthetic lifestyle,0.0,Neutral
it's a wonderful app. Whatever I look for I surely find easily. Great inspirations,5,2026-02-28 09:16:36,its a wonderful app whatever i look for i surely find easily great inspirations,0.7666666666666666,Positive
i like this app very much,5,2026-02-28 09:15:11,i like this app very much,0.26,Positive
👍🏻,5,2026-02-28 09:09:11,,0.0,Neutral
Pinterest app bahut achcha aur bahut imandar app,5,2026-02-28 09:06:48,pinterest app bahut achcha aur bahut imandar app,0.0,Neutral
it is the best no lags it's perfect,5,2026-02-28 08:56:37,it is the best no lags its perfect,1.0,Positive
most relatable app...<3,5,2026-02-28 08:52:06,most relatable app,0.5,Positive
why am I locked out of my account,1,2026-02-28 08:49:21,why am i locked out of my account,0.0,Neutral
well app,5,2026-02-28 08:43:14,well app,0.0,Neutral
Very good app,5,2026-02-28 08:43:07,very good app,0.9099999999999999,Positive
bestest appp,4,2026-02-28 08:39:13,bestest appp,0.0,Neutral
A lot of information,5,2026-02-28 08:26:43,a lot of information,0.0,Neutral
can we just.... not favorite/unfavorite pins anymore? the icon doesn't show up at all no matter how many times I restart the app,1,2026-02-28 08:24:04,can we just not favoriteunfavorite pins anymore the icon doesnt show up at all no matter how many times i restart the app,0.5,Positive
please block,1,2026-02-28 08:23:55,please block,0.0,Neutral
Pinterest ❤️❤️,5,2026-02-28 08:02:13,pinterest ,0.0,Neutral
horrible ai,1,2026-02-28 07:53:53,horrible ai,-1.0,Negative
one of the best app,4,2026-02-28 07:49:23,one of the best app,1.0,Positive
you want photos or anything else you can you can buy here offering and also you can you can do yourself also and also even do or such a creative app,5,2026-02-28 07:48:58,you want photos or anything else you can you can buy here offering and also you can you can do yourself also and also even do or such a creative app,0.25,Positive
Nice,5,2026-02-28 07:34:33,nice,0.6,Positive
"pinterest is the best app i have ever seen, overall it's a good app but sometimes even if my network is working it just doesn't load and i have to wait for hours to use the app i keep checking if app in loading now, please fix this if it's issue of the app i tried to fix it but it's not fixing, Thanks.",4,2026-02-28 07:30:57,pinterest is the best app i have ever seen overall its a good app but sometimes even if my network is working it just doesnt load and i have to wait for hours to use the app i keep checking if app in loading now please fix this if its issue of the app i tried to fix it but its not fixing thanks,0.475,Positive
good,5,2026-02-28 07:29:11,good,0.7,Positive
great,5,2026-02-28 07:28:52,great,0.8,Positive
very best,5,2026-02-28 07:24:35,very best,1.0,Positive
best app,5,2026-02-28 07:20:44,best app,1.0,Positive
during bored...this is so good for entertaining 🎀🍒💖💕🤩..........,4,2026-02-28 07:19:44,during boredthis is so good for entertaining ,0.6,Positive
very nice app,5,2026-02-28 07:19:38,very nice app,0.78,Positive
it's very good app,5,2026-02-28 07:16:06,its very good app,0.9099999999999999,Positive
I literally love this app 💕😍,5,2026-02-28 07:14:06,i literally love this app ,0.5,Positive
"It is my go-to app for finding creative idea lines to follow since for all thins life; be it food, fashion and artsy stuff. It is really a fun app that engages my mind",5,2026-02-28 06:59:32,it is my goto app for finding creative idea lines to follow since for all thins life be it food fashion and artsy stuff it is really a fun app that engages my mind,0.4,Positive
Annoying sometimes,5,2026-02-28 06:59:31,annoying sometimes,-0.8,Negative
best aap fo my life,5,2026-02-28 06:52:14,best aap fo my life,1.0,Positive
♥️❤️🈵🈳🈵🈸🈺🉑🉐㊙️㊗️🈴🈵🈹🈲🈶🈚🈸🈺🈷️,5,2026-02-28 06:52:08,,0.0,Neutral
it's an amazing app where you can find a variety of images wealth researching for!,5,2026-02-28 06:48:34,its an amazing app where you can find a variety of images wealth researching for,0.6000000000000001,Positive
so aesthetic!! 😍,5,2026-02-28 06:40:36,so aesthetic ,0.0,Neutral
very good app,5,2026-02-28 06:39:38,very good app,0.9099999999999999,Positive
worst,1,2026-02-28 06:38:19,worst,-1.0,Negative
VIP man,5,2026-02-28 06:32:13,vip man,0.0,Neutral
"Pinterest is the best app.no glitch.,works smoothly and the best part is that YouTube is also available ........ I recommend that download the Pinterest app now.🎀",4,2026-02-28 06:25:55,pinterest is the best appno glitchworks smoothly and the best part is that youtube is also available i recommend that download the pinterest app now,0.7,Positive
"every other post was sponsored when I would do a search and wouldn't be links to posts but to products ... I'm looking for blog posts to read, not books, subscriptions, and apps to purchase.",2,2026-02-28 06:24:54,every other post was sponsored when i would do a search and wouldnt be links to posts but to products im looking for blog posts to read not books subscriptions and apps to purchase,-0.125,Negative
best app,5,2026-02-28 06:12:30,best app,1.0,Positive
I love the app but it destroys its value because of the AI generated photos. I suggest you should ban AI photos there.,3,2026-02-28 06:10:16,i love the app but it destroys its value because of the ai generated photos i suggest you should ban ai photos there,0.5,Positive
love,5,2026-02-28 06:08:05,love,0.5,Positive
I love pinterest it gives me pics that I can use for edits and stuff like that,5,2026-02-28 06:07:57,i love pinterest it gives me pics that i can use for edits and stuff like that,0.5,Positive
ai mods suck butts,1,2026-02-28 06:06:46,ai mods suck butts,0.0,Neutral
very helpful,5,2026-02-28 06:06:07,very helpful,0.2,Positive
excellent app,5,2026-02-28 06:04:44,excellent app,1.0,Positive
It us very good for Profile pics and very helpful,5,2026-02-28 06:03:32,it us very good for profile pics and very helpful,0.5549999999999999,Positive
very very nice,5,2026-02-28 06:00:42,very very nice,0.78,Positive
I love it best app I ever seen,5,2026-02-28 05:57:31,i love it best app i ever seen,0.75,Positive
great app to use. suitable for all age,5,2026-02-28 05:54:00,great app to use suitable for all age,0.675,Positive
such a great app,5,2026-02-28 05:40:17,such a great app,0.4,Positive
video 👍👍👍👍,5,2026-02-28 05:34:18,video ,0.0,Neutral
best app for photo,3,2026-02-28 05:24:10,best app for photo,1.0,Positive
very nice,5,2026-02-28 05:15:46,very nice,0.78,Positive
it is so helpful for me,5,2026-02-28 05:12:22,it is so helpful for me,0.0,Neutral
"My favourite one of all time!! Pinterest is way more better than YouTube, instagram, snapchat...so much information and entertainment",5,2026-02-28 05:12:13,my favourite one of all time pinterest is way more better than youtube instagram snapchatso much information and entertainment,0.39999999999999997,Positive
so beautiful 😍,5,2026-02-28 05:07:06,so beautiful ,0.85,Positive
it's like so cool 🫐,5,2026-02-28 04:53:17,its like so cool ,0.35,Positive
that's wonderful app 😊🔥,5,2026-02-28 04:42:28,thats wonderful app ,1.0,Positive
nice app,4,2026-02-28 04:37:22,nice app,0.6,Positive
"""Pinterest is an exceptional app for visual inspiration. Whether it's home decor, fashion, or DIY projects, you can find brilliant ideas for everything here. Its interface is very smooth, and organizing ideas into 'boards' is incredibly easy. The best part is its accurate algorithm, which always provides high-quality and relevant suggestions. For creative people, this app is nothing less than a goldmine.""",5,2026-02-28 04:35:56,pinterest is an exceptional app for visual inspiration whether its home decor fashion or diy projects you can find brilliant ideas for everything here its interface is very smooth and organizing ideas into boards is incredibly easy the best part is its accurate algorithm which always provides highquality and relevant suggestions for creative people this app is nothing less than a goldmine,0.4653333333333333,Positive
i like this app very much,5,2026-02-28 04:30:18,i like this app very much,0.26,Positive
nice to Dennise Torino Wardhana Putri..,5,2026-02-28 04:29:12,nice to dennise torino wardhana putri,0.6,Positive
"I would do five starts, but there's now ai and its so stupid. ban ai on Pinterest and then I'll give it a five star rating",4,2026-02-28 04:20:02,i would do five starts but theres now ai and its so stupid ban ai on pinterest and then ill give it a five star rating,-0.6499999999999999,Negative
"I was able to look past the egregious amount of ads, but AI is where I draw the line, especially used the capacity Pinterest is. I'm disappointed that somewhere I look for inspiration has been turned into the ban wild west and basically a rotating billboard, all in the name of what? Who does this AI serve? It isn't helping users, that's for sure. I will look for inspiration in other places that don't use AI recklessly (or at all, preferably).",1,2026-02-28 04:10:35,i was able to look past the egregious amount of ads but ai is where i draw the line especially used the capacity pinterest is im disappointed that somewhere i look for inspiration has been turned into the ban wild west and basically a rotating billboard all in the name of what who does this ai serve it isnt helping users thats for sure i will look for inspiration in other places that dont use ai recklessly or at all preferably,-0.003571428571428575,Negative
Ruined a good thing. it's all ads and AI slop,1,2026-02-28 04:09:53,ruined a good thing its all ads and ai slop,0.7,Positive
I find it very useful for about anything you can think of.,4,2026-02-28 04:03:02,i find it very useful for about anything you can think of,0.39,Positive
it's amazing app,3,2026-02-28 04:02:44,its amazing app,0.6000000000000001,Positive
I mean... it's Pinterest 🌹,5,2026-02-28 03:58:20,i mean its pinterest ,-0.3125,Negative
this app is so cool,5,2026-02-28 03:52:52,this app is so cool,0.35,Positive
Great app and easy to navigate. The backdrop to my life!,5,2026-02-28 03:40:53,great app and easy to navigate the backdrop to my life,0.6166666666666667,Positive
Ilove this app it helps me find new backround ideas and new room ideas.,5,2026-02-28 03:05:51,ilove this app it helps me find new backround ideas and new room ideas,0.13636363636363635,Positive
"Great, inspiring for ideas, love this app",5,2026-02-28 03:04:39,great inspiring for ideas love this app,0.6,Positive
