review,rating,date,clean_review,polarity,sentiment
WAY to buggy like badly buggy here's some bugs 1 whenever u open the app the post button isn't there 2 u couldn't change ur cover for sum time(old) 3 whenever u tried to open ur gallery or change ur pfp on the app it wouldn't show ur pictures just a blank screen this app is so infuriating to use cuz of how buggy it is fix this,1,2026-03-04 14:05:09,way to buggy like badly buggy heres some bugs whenever u open the app the post button isnt there u couldnt change ur cover for sum timeold whenever u tried to open ur gallery or change ur pfp on the app it wouldnt show ur pictures just a blank screen this app is so infuriating to use cuz of how buggy it is fix this,-0.25999999999999995,Negative
Love Pinterest. You can find anything you want.,5,2026-03-04 13:57:30,love pinterest you can find anything you want,0.5,Positive
"Just two requests: °The ads need to go completely! Pinterest now seems like a completely different app. I want my favourite app back. °The scroll feed, which I (personally) really liked. It was so fun. I'd love to have it back as a permanent feature (along with the classic grid layout).",2,2026-03-04 13:56:00,just two requests the ads need to go completely pinterest now seems like a completely different app i want my favourite app back the scroll feed which i personally really liked it was so fun id love to have it back as a permanent feature along with the classic grid layout,0.20833333333333334,Positive
it's the best app for searching images and making collages,5,2026-03-04 13:54:30,its the best app for searching images and making collages,1.0,Positive
"I have been discouraged with the amount of ads sneaking into Pinterest. Then when you click on the pins you get more ads! Also tired of getting rude emails about pins I have added to my library and they label as ""misinformation"". Quotes, opinions, and views are being judged and labeled unfairly. Though I have gotten great recipes and ideas from some fantastic creators, I have considered deleting...",3,2026-03-04 13:49:39,i have been discouraged with the amount of ads sneaking into pinterest then when you click on the pins you get more ads also tired of getting rude emails about pins i have added to my library and they label as misinformation quotes opinions and views are being judged and labeled unfairly though i have gotten great recipes and ideas from some fantastic creators i have considered deleting,0.08333333333333336,Positive
they are a piece of poop 💩 they will delete your account bc you save something they allowed someone to put something inappropriate on there but your the one that is at fault it's wrong the other people should get in trouble to,1,2026-03-04 13:35:21,they are a piece of poop they will delete your account bc you save something they allowed someone to put something inappropriate on there but your the one that is at fault its wrong the other people should get in trouble to,-0.27499999999999997,Negative
"it randomly says ""user not found"" and if doesn't open no matter what I do. pls fix it",1,2026-03-04 13:34:54,it randomly says user not found and if doesnt open no matter what i do pls fix it,-0.25,Negative
this is amazing app . I like it,5,2026-03-04 13:20:54,this is amazing app i like it,0.6000000000000001,Positive
wow kya app he💝,5,2026-03-04 13:18:47,wow kya app he,0.1,Positive
"Worst content moderation I have ever had the misfortune of witnessing. I have received tens (if not hundreds) of guideline violations for pins I have saved, despite them being completely innocent, while nudity and other provocative/violent content that I HAVE REPORTED is never taken down. Horrendous!",1,2026-03-04 13:17:09,worst content moderation i have ever had the misfortune of witnessing i have received tens if not hundreds of guideline violations for pins i have saved despite them being completely innocent while nudity and other provocativeviolent content that i have reported is never taken down horrendous,-0.1951388888888889,Negative
"I always have a huge selection of what im looking for ,or reading up on And its never surprises new hoops to jump through like basically all the other populR apps,so nice keep up the easy process to search topics go to that topic it sucks when its a total new headache each time",4,2026-03-04 13:14:43,i always have a huge selection of what im looking for or reading up on and its never surprises new hoops to jump through like basically all the other populr appsso nice keep up the easy process to search topics go to that topic it sucks when its a total new headache each time,0.16013257575757572,Positive
full of ads,1,2026-03-04 13:14:37,full of ads,0.35,Positive
i Like it,5,2026-03-04 13:13:15,i like it,0.0,Neutral
it's good,5,2026-03-04 13:06:17,its good,0.7,Positive
bahut Ganda Hai Pinterest Koi download nahin karo isase achcha to tum aur koi sa app download Kar Lo ya FIR chupchap baitho yah Pinterest ki bahan ki aankh bilkul mat karna hai kyunki bhai Pinterest wale tum kaise Insan Ho har matlab kuchh bhi yaar kuchh bhi Kar Lo Main apni asali rate Dal raha hun but to date ki dard ki vah date off birth ki to Tum bol do galat hai tumko nahin Le sakti ho tumhara samay kharab Hai to Bhai yah kya baat ho yaar Sahi date dalo to galat galat,1,2026-03-04 13:05:40,bahut ganda hai pinterest koi download nahin karo isase achcha to tum aur koi sa app download kar lo ya fir chupchap baitho yah pinterest ki bahan ki aankh bilkul mat karna hai kyunki bhai pinterest wale tum kaise insan ho har matlab kuchh bhi yaar kuchh bhi kar lo main apni asali rate dal raha hun but to date ki dard ki vah date off birth ki to tum bol do galat hai tumko nahin le sakti ho tumhara samay kharab hai to bhai yah kya baat ho yaar sahi date dalo to galat galat,0.16666666666666666,Positive
good,5,2026-03-04 13:03:51,good,0.7,Positive
superb,5,2026-03-04 12:59:32,superb,1.0,Positive
so cool,5,2026-03-04 12:54:28,so cool,0.35,Positive
The search results are irrelevant let me find other stuff not just the same pins or topic I searched like im looping in the rooms.,1,2026-03-04 12:50:06,the search results are irrelevant let me find other stuff not just the same pins or topic i searched like im looping in the rooms,-0.20833333333333334,Negative
"this is literally the best app ever, i absolutely luvvvv it!",4,2026-03-04 12:39:20,this is literally the best app ever i absolutely luvvvv it,0.6,Positive
"Pinterest is honestly my favorite place to go whenever I need a bit of creative inspiration or a new project to start. I love how easy it is to organize different ideas into boards, whether I'm planning a home renovation or just looking for new recipes. The visual search tool is pretty incredible for finding similar items, and the algorithm is great at suggesting things I actually like. It’s such a chill, positive space to get lost in for a while and find some really unique ideas. It definitely",5,2026-03-04 12:34:04,pinterest is honestly my favorite place to go whenever i need a bit of creative inspiration or a new project to start i love how easy it is to organize different ideas into boards whether im planning a home renovation or just looking for new recipes the visual search tool is pretty incredible for finding similar items and the algorithm is great at suggesting things i actually like its such a chill positive space to get lost in for a while and find some really unique ideas it definitely,0.2799019607843137,Positive
nice,5,2026-03-04 12:25:03,nice,0.6,Positive
the is the best app even i see i made so many photo and video with help of this app,4,2026-03-04 12:22:28,the is the best app even i see i made so many photo and video with help of this app,0.75,Positive
Trash.,1,2026-03-04 12:20:11,trash,0.0,Neutral
Lots of great ideas and recipes. 😀,5,2026-03-04 12:14:12,lots of great ideas and recipes ,0.8,Positive
bad app,1,2026-03-04 12:07:33,bad app,-0.6999999999999998,Negative
the best 💖,5,2026-03-04 12:06:10,the best ,1.0,Positive
greatttttt👍🏻👍🏻,4,2026-03-04 12:05:48,greatttttt,0.0,Neutral
exceptional,5,2026-03-04 11:52:28,exceptional,0.6666666666666666,Positive
"It's a great app and I definitely love it, but half of it is just ads now. It's so annoying and ruins the app. It's actually so tiring.",2,2026-03-04 11:46:37,its a great app and i definitely love it but half of it is just ads now its so annoying and ruins the app its actually so tiring,0.030555555555555544,Positive
"Dashboard is at least 50% ads, far too many for an enjoyable experience.",1,2026-03-04 11:44:13,dashboard is at least ads far too many for an enjoyable experience,0.2,Positive
it's useful for daily life 😁,5,2026-03-04 11:40:59,its useful for daily life ,0.15,Positive
Please add an option to upload multiple photos as a carousel instead of automatically converting them into a video. This feature would make posting much easier and more user-friendly.,3,2026-03-04 11:40:42,please add an option to upload multiple photos as a carousel instead of automatically converting them into a video this feature would make posting much easier and more userfriendly,0.2333333333333333,Positive
designs are best and search results are excellent,4,2026-03-04 11:36:34,designs are best and search results are excellent,1.0,Positive
Great platform for ideas and inspiration. Easy to explore and save creative content.,5,2026-03-04 11:33:35,great platform for ideas and inspiration easy to explore and save creative content,0.5777777777777778,Positive
يخبللل يموتتتتتت يجنن🎀🫶😭😭😭😭💋🌺🌺🌺🌺✨💗💗💗🎀🎀🎀🌸🌸😭🫶💋💋💋💋,5,2026-03-04 11:12:06, ,0.0,Neutral
very good app it is,5,2026-03-04 11:11:45,very good app it is,0.9099999999999999,Positive
its a good app,5,2026-03-04 11:05:44,its a good app,0.7,Positive
best app,5,2026-03-04 10:46:33,best app,1.0,Positive
"everything is great, maybe give us the ability to download videos 🤷🏾‍♂️",5,2026-03-04 10:46:28,everything is great maybe give us the ability to download videos ,0.8,Positive
This app is fantastic and marvellous and beautiful.,5,2026-03-04 10:40:22,this app is fantastic and marvellous and beautiful,0.625,Positive
good,5,2026-03-04 10:38:23,good,0.7,Positive
I loveeeeee this app literally it's my favourite,5,2026-03-04 10:10:27,i loveeeeee this app literally its my favourite,0.0,Neutral
i love it,5,2026-03-04 09:59:49,i love it,0.5,Positive
very nice 👍👍👍👍👍,5,2026-03-04 09:41:07,very nice ,0.78,Positive
its a very best app i like it,5,2026-03-04 09:40:32,its a very best app i like it,1.0,Positive
it's nice but taking too much data,5,2026-03-04 09:21:27,its nice but taking too much data,0.4,Positive
"Update: Better. Edit: I love this app but please stop refreshing the feed automatically on the home screen, that's all! 👍 (had rated it five stars before but this problem still remains so two stars now, please fix this annoying problem, really)(update: better, so 4 stars)",4,2026-03-04 09:20:57,update better edit i love this app but please stop refreshing the feed automatically on the home screen thats all had rated it five stars before but this problem still remains so two stars now please fix this annoying problem reallyupdate better so stars,0.24,Positive
very very very very good app I like it,5,2026-03-04 09:15:35,very very very very good app i like it,0.9099999999999999,Positive
Never short of inspirational ideas,5,2026-03-04 09:11:07,never short of inspirational ideas,0.25,Positive
Best Socoal Meadia App,5,2026-03-04 09:06:28,best socoal meadia app,1.0,Positive
"it's a very good platform to enjoy your free time .you can watch anime video ,download high quality videos etc🐤",4,2026-03-04 09:06:17,its a very good platform to enjoy your free time you can watch anime video download high quality videos etc,0.46749999999999997,Positive
fav aap,5,2026-03-04 09:02:07,fav aap,0.0,Neutral
good,5,2026-03-04 08:59:58,good,0.7,Positive
I love it,5,2026-03-04 08:59:02,i love it,0.5,Positive
good 😊 when I using this app thank for some re very too high expensive so I interesting.,5,2026-03-04 08:48:32,good when i using this app thank for some re very too high expensive so i interesting,0.21199999999999997,Positive
All the best,5,2026-03-04 08:39:43,all the best,1.0,Positive
nice,5,2026-03-04 08:26:18,nice,0.6,Positive
Shows a lot inspiration and great different style,5,2026-03-04 08:18:48,shows a lot inspiration and great different style,0.4,Positive
not letting me enter,1,2026-03-04 08:03:07,not letting me enter,0.0,Neutral
goodjoob,5,2026-03-04 08:00:16,goodjoob,0.0,Neutral
so good and pretty... my favvv... love sm,5,2026-03-04 07:44:40,so good and pretty my favvv love sm,0.48333333333333334,Positive
nice,4,2026-03-04 07:40:05,nice,0.6,Positive
wow it's my helping,5,2026-03-04 07:39:07,wow its my helping,0.1,Positive
This app is very useful.We can use it for searching anything,5,2026-03-04 07:33:22,this app is very usefulwe can use it for searching anything,0.2,Positive
I want the Naked pictures please,5,2026-03-04 07:29:52,i want the naked pictures please,0.0,Neutral
THIS app is wonderful. keeps me on my toes.,4,2026-03-04 07:18:02,this app is wonderful keeps me on my toes,1.0,Positive
itbis heartwarming and nessasary to use 😄,5,2026-03-04 07:17:59,itbis heartwarming and nessasary to use ,0.0,Neutral
Superb!! love it... recommending to try this app.... explore the exclusive ideas 💡💡,5,2026-03-04 07:10:19,superb love it recommending to try this app explore the exclusive ideas ,0.75,Positive
Ghajab mean awesome 👌 👏 👍,5,2026-03-04 06:57:52,ghajab mean awesome ,0.34375,Positive
"Excellent 👌 am from Uganda this app has a lot of fashion ideas u have never seen and the most interesting part of it has spiritual awakening staff ,, 100%",5,2026-03-04 06:52:02,excellent am from uganda this app has a lot of fashion ideas u have never seen and the most interesting part of it has spiritual awakening staff ,0.5,Positive
great.,5,2026-03-04 06:39:02,great,0.8,Positive
Great place to discover things and set up your own pins.,5,2026-03-04 06:25:51,great place to discover things and set up your own pins,0.7,Positive
I generally am very happy with this app. I can ignore the ads and it's possible to turn off the auto play that pauses music and stuff. The one issue I have right now is that vertically long pins have borders on either side of them that make them impossible to see/read. And when using the app I can't even zoom in and scroll. In order to properly see the pin I have to download it and that is so utterly unnecessary when the old system worked just fine that I am considering uninstalling the app.,5,2026-03-04 06:16:54,i generally am very happy with this app i can ignore the ads and its possible to turn off the auto play that pauses music and stuff the one issue i have right now is that vertically long pins have borders on either side of them that make them impossible to seeread and when using the app i cant even zoom in and scroll in order to properly see the pin i have to download it and that is so utterly unnecessary when the old system worked just fine that i am considering uninstalling the app,0.07619047619047617,Positive
"I love Pinterest. when I need to know something I go to Pinterest. When I want to bake or cook, I go TO PINTEREST. Love it.",5,2026-03-04 06:13:11,i love pinterest when i need to know something i go to pinterest when i want to bake or cook i go to pinterest love it,0.5,Positive
"I really like this application, it's great, it can help me when I'm looking for the photos I want.",5,2026-03-04 06:12:26,i really like this application its great it can help me when im looking for the photos i want,0.5,Positive
useful aap,5,2026-03-04 05:56:23,useful aap,0.3,Positive
Its good,5,2026-03-04 05:52:28,its good,0.7,Positive
"Perfect For Wallpapers,Funny Reaction pictures for Tiktok or Messages with friends, Great for hair inspirations or Even outfits.",5,2026-03-04 05:48:37,perfect for wallpapersfunny reaction pictures for tiktok or messages with friends great for hair inspirations or even outfits,0.9,Positive
can't copy text in the description lol,1,2026-03-04 05:45:51,cant copy text in the description lol,0.8,Positive
IT's VERY USEFULL APPLICATION,5,2026-03-04 05:28:01,its very usefull application,0.2,Positive
good app,5,2026-03-04 05:26:41,good app,0.7,Positive
Its so goodd,5,2026-03-04 05:26:39,its so goodd,0.0,Neutral
accounts won't load neither will boards at times,3,2026-03-04 05:26:01,accounts wont load neither will boards at times,0.0,Neutral
crashes at some time,2,2026-03-04 05:22:47,crashes at some time,0.0,Neutral
Easy to use. They are on your side.,5,2026-03-04 05:21:29,easy to use they are on your side,0.43333333333333335,Positive
Asthetic wallpaper,5,2026-03-04 05:02:08,asthetic wallpaper,0.0,Neutral
"i love this app but it has not working for me lately. it keeps randomly saying ""user not found"" and completely empty. other times its fine.",3,2026-03-04 04:58:01,i love this app but it has not working for me lately it keeps randomly saying user not found and completely empty other times its fine,-0.018055555555555557,Negative
quiet nice I'd say it helps me find hilarious reaction pics and awesome profile pictures and it has some pretty funny memes too and in general is a good app,5,2026-03-04 04:39:42,quiet nice id say it helps me find hilarious reaction pics and awesome profile pictures and it has some pretty funny memes too and in general is a good app,0.41874999999999996,Positive
It so useful if you need reference,5,2026-03-04 04:39:39,it so useful if you need reference,0.3,Positive
😶😹😅🌅🌇😊🎉💐😻☕😭😒🚬🖤☺️😄😘💤🙄🌞🥰🍰🎊🥺😐🎊😂😂😅,5,2026-03-04 04:32:41,,0.0,Neutral
great app for looking up just about everything. within reason of course. Just stay out of the comments.... at times it's worse then X/Twitter.,3,2026-03-04 04:27:52,great app for looking up just about everything within reason of course just stay out of the comments at times its worse then xtwitter,0.2,Positive
Amazing but videos can't download 🥺,5,2026-03-04 04:23:01,amazing but videos cant download ,0.6000000000000001,Positive
Very practical,5,2026-03-04 04:15:43,very practical,0.2,Positive
cool,5,2026-03-04 04:14:31,cool,0.35,Positive
ok,5,2026-03-04 04:02:01,ok,0.5,Positive
Pinterest app not installingg,5,2026-03-04 03:56:25,pinterest app not installingg,0.0,Neutral
exalted,5,2026-03-04 03:53:30,exalted,0.0,Neutral
you better start counting your days pinterest for always labeling my artwork as ai modified,1,2026-03-04 03:27:30,you better start counting your days pinterest for always labeling my artwork as ai modified,0.5,Positive
"""Level up your Mini Militia game with these essential voice codes! 🚀 Communicate with your squad and dominate the battlefield. #MiniMilitia #Gaming #VoiceCodes""",5,2026-03-04 03:19:29,level up your mini militia game with these essential voice codes communicate with your squad and dominate the battlefield minimilitia gaming voicecodes,-0.2,Negative
I've reset my algorithm multiple times and I'm still seeing nothing but lingerie and anime figures. I don't understand it.,1,2026-03-04 03:15:01,ive reset my algorithm multiple times and im still seeing nothing but lingerie and anime figures i dont understand it,0.0,Neutral
😊,5,2026-03-04 03:00:54,,0.0,Neutral
Super App,5,2026-03-04 02:58:53,super app,0.3333333333333333,Positive
Ravinder Kumar,3,2026-03-04 02:52:43,ravinder kumar,0.0,Neutral
this is best,5,2026-03-04 02:46:09,this is best,1.0,Positive
Please fix the incorrect pin count on a board because every group of about 30 pins are duplicated when scrolling through all my boards.,1,2026-03-04 02:39:27,please fix the incorrect pin count on a board because every group of about pins are duplicated when scrolling through all my boards,0.0,Neutral
very good,5,2026-03-04 02:34:13,very good,0.9099999999999999,Positive
its awesome,5,2026-03-04 02:31:42,its awesome,1.0,Positive
"Good for aesthetic picture and more beautiful, Nature peace available ther...",5,2026-03-04 02:31:26,good for aesthetic picture and more beautiful nature peace available ther,0.6124999999999999,Positive
it gives nice ideas 💡 👌 so it deserve's 5 stars 🌟 🤩,5,2026-03-04 02:27:37,it gives nice ideas so it deserves stars ,0.6,Positive
very nice and beautiful pictures,5,2026-03-04 02:22:22,very nice and beautiful pictures,0.815,Positive
dude whyd my pinterest delete itself,3,2026-03-04 02:22:00,dude whyd my pinterest delete itself,0.0,Neutral
good,5,2026-03-04 02:16:59,good,0.7,Positive
It's easier to navigate this app. more than other apps for getting information.,5,2026-03-04 02:14:38,its easier to navigate this app more than other apps for getting information,0.1875,Positive
"I keep getting violations from pins I SAVED AND DIDN'T MAKE, it's quite stupid, there are way to many ads as well, and along with that, I try setting my algorithms to how I like it it isn't working, for example I save multiple creepypasta pins and it still shows what I don't like, plus I have reported many p3dof!le ships of two 30 year olds and a 16 year old, it's disgusting, fix it, And no matter how many times I click ""not interested"" on something it still shows me it, Fix these problems pls.",3,2026-03-04 02:12:39,i keep getting violations from pins i saved and didnt make its quite stupid there are way to many ads as well and along with that i try setting my algorithms to how i like it it isnt working for example i save multiple creepypasta pins and it still shows what i dont like plus i have reported many pdofle ships of two year olds and a year old its disgusting fix it and no matter how many times i click not interested on something it still shows me it fix these problems pls,-0.040624999999999994,Negative
great,5,2026-03-04 02:09:35,great,0.8,Positive
"No interest in it, yet it automatically downloaded onto my phone. You wouldn't have gotten a low review if you didn't have your app auto-download on my phone somehow.",2,2026-03-04 02:09:14,no interest in it yet it automatically downloaded onto my phone you wouldnt have gotten a low review if you didnt have your app autodownload on my phone somehow,0.0,Neutral
"it's great, I love the thing, I always use it. keyword: always. it's genuinely addictive because of the algorithm that tunes itself to what you look at, so be careful what you keep on your algorithm. I'm trying to look at helpful posts and not things that are just TikTok reposts and posts that support that constant flow of dopamine we've been accustomed to. It's healthier to just limit your screentime on it. it's amazing for finding art inspiration, recipes, and phone wallpapers.",3,2026-03-04 01:43:59,its great i love the thing i always use it keyword always its genuinely addictive because of the algorithm that tunes itself to what you look at so be careful what you keep on your algorithm im trying to look at helpful posts and not things that are just tiktok reposts and posts that support that constant flow of dopamine weve been accustomed to its healthier to just limit your screentime on it its amazing for finding art inspiration recipes and phone wallpapers,0.3,Positive
has basically everything very fun to make projects 10/10 recommend,5,2026-03-04 01:36:26,has basically everything very fun to make projects recommend,0.39,Positive
OH MAN THIS IS AMAZING i can see my favorite fandoms here great job Pinterest community!!,5,2026-03-04 01:30:12,oh man this is amazing i can see my favorite fandoms here great job pinterest community,0.6333333333333334,Positive
Always great to see and hear all the new ideas on Pinterest.,5,2026-03-04 01:29:05,always great to see and hear all the new ideas on pinterest,0.4681818181818182,Positive
Great,5,2026-03-04 01:11:30,great,0.8,Positive
There are too many ads and too much AI.,2,2026-03-04 00:55:36,there are too many ads and too much ai,0.35,Positive
"Was a great app, but they have so many ads now, you can't do anything. So frustrating. I realize ads keep it free, but we could pay the national debt down with all the ads on this app.",1,2026-03-04 00:43:46,was a great app but they have so many ads now you cant do anything so frustrating i realize ads keep it free but we could pay the national debt down with all the ads on this app,0.22888888888888886,Positive
Pinterest has been my best resource for eating healthier. I found so many wonderful recipes. I've been with Pinterest for many years. Highly recommend this platform. 🌟🌟🌟🌟🌟,5,2026-03-04 00:41:28,pinterest has been my best resource for eating healthier i found so many wonderful recipes ive been with pinterest for many years highly recommend this platform ,0.632,Positive
love you look,5,2026-03-04 00:39:38,love you look,0.5,Positive
I love everything about this site. it always gives me good ideas.,5,2026-03-04 00:38:38,i love everything about this site it always gives me good ideas,0.6,Positive
so good,5,2026-03-04 00:30:41,so good,0.7,Positive
excellent,5,2026-03-04 00:28:10,excellent,1.0,Positive
I love Pinterest it's a p;ace for great ideas to come to life,5,2026-03-04 00:27:01,i love pinterest its a pace for great ideas to come to life,0.65,Positive
Pinterest is just amazing! You can find almost anything need and want on here! Search up your favorite things!,5,2026-03-04 00:25:26,pinterest is just amazing you can find almost anything need and want on here search up your favorite things,0.55,Positive
nice one,5,2026-03-04 00:18:05,nice one,0.6,Positive
the best app I had ever seen love it,5,2026-03-03 23:50:52,the best app i had ever seen love it,0.75,Positive
I dont like the ads I get from my games for this site.,1,2026-03-03 23:25:52,i dont like the ads i get from my games for this site,0.0,Neutral
Turdyu,5,2026-03-03 23:09:50,turdyu,0.0,Neutral
