review,rating,date,clean_review,polarity,sentiment
love this app find any and everything. easy to use.makes crafting easy.,5,2026-03-02 15:52:15,love this app find any and everything easy to usemakes crafting easy,0.45555555555555555,Positive
good ❤️,5,2026-03-02 15:47:40,good ,0.7,Positive
it is awesome it helps me with so much stuff,5,2026-03-02 15:45:50,it is awesome it helps me with so much stuff,0.6,Positive
Pinterest memang terbaik untuk cari idea dan inspirasi. Banyak gambar dan tutorial menarik 👍,5,2026-03-02 15:37:14,pinterest memang terbaik untuk cari idea dan inspirasi banyak gambar dan tutorial menarik ,0.0,Neutral
this apl is very good,5,2026-03-02 15:35:01,this apl is very good,0.9099999999999999,Positive
Best app I have ever used. Thanks for this!❤️,5,2026-03-02 15:33:47,best app i have ever used thanks for this,0.6,Positive
very good 👍😊,5,2026-03-02 15:28:11,very good ,0.9099999999999999,Positive
"My experience with Pinterest has been creative and inspiring. I use Pinterest to share attractive pins and discover new fashion ideas and trends. Creating pins helps me improve my creativity, design sense, and content skills. I enjoy selecting products, writing titles, and sharing ideas with a wider audience. Pinterest motivates me to stay consistent, learn digital marketing basics, and grow my confidence while exploring online opportunities and creative expression.",5,2026-03-02 15:25:08,my experience with pinterest has been creative and inspiring i use pinterest to share attractive pins and discover new fashion ideas and trends creating pins helps me improve my creativity design sense and content skills i enjoy selecting products writing titles and sharing ideas with a wider audience pinterest motivates me to stay consistent learn digital marketing basics and grow my confidence while exploring online opportunities and creative expression,0.38579545454545455,Positive
Interface is taking too much time to reload the content.,1,2026-03-02 15:23:37,interface is taking too much time to reload the content,0.2,Positive
great recipes & info.,5,2026-03-02 15:20:14,great recipes info,0.8,Positive
hiu,5,2026-03-02 15:17:21,hiu,0.0,Neutral
very very excellent 👌👍,5,2026-03-02 15:06:55,very very excellent ,1.0,Positive
Best app EVEERRR!!!🎀✨️,5,2026-03-02 14:55:33,best app eveerrr,1.0,Positive
Haha my most fav app ever to just doom scroll and look for inspos for my vision board!,5,2026-03-02 14:54:58,haha my most fav app ever to just doom scroll and look for inspos for my vision board,0.35,Positive
👍👍👍👍👍👍,5,2026-03-02 14:52:30,,0.0,Neutral
its good and has amazing ideas,5,2026-03-02 14:50:19,its good and has amazing ideas,0.65,Positive
It’s really a good app by it I get so many new ideas,5,2026-03-02 14:49:18,its really a good app by it i get so many new ideas,0.4454545454545455,Positive
"I have never rated apps in my entire life but Pinterest deserves it. This is a very helpful app for studying, DIY, fun videos, thrift, art and what not! Thanks to Pinterest!",5,2026-03-02 14:48:16,i have never rated apps in my entire life but pinterest deserves it this is a very helpful app for studying diy fun videos thrift art and what not thanks to pinterest,0.1,Positive
as it help me grow my aesthetic and channel,5,2026-03-02 14:44:32,as it help me grow my aesthetic and channel,0.0,Neutral
"it""s a very good app🍃",5,2026-03-02 14:43:04,its a very good app,0.9099999999999999,Positive
nice app indian,5,2026-03-02 14:41:55,nice app indian,0.6,Positive
so good but the massage setting is no 5🌟,4,2026-03-02 14:40:31,so good but the massage setting is no ,0.7,Positive
هو برنامج جميل بس بيعلق ساعات,5,2026-03-02 14:33:18, ,0.0,Neutral
why do videos take so long to upload? I have reuploaded it at least 4 times and its still glitching.,1,2026-03-02 14:31:40,why do videos take so long to upload i have reuploaded it at least times and its still glitching,-0.175,Negative
my fav apps to search idea for my video or photo content. The photo is also on HD when downloaded. Loving it!,5,2026-03-02 14:30:07,my fav apps to search idea for my video or photo content the photo is also on hd when downloaded loving it,0.6,Positive
"My visual inspiration hub 🎨! Love discovering ideas, saving pins, and creating boards. Perfect for planning and creativity 💡",5,2026-03-02 14:26:02,my visual inspiration hub love discovering ideas saving pins and creating boards perfect for planning and creativity ,0.5,Positive
"imo anyone with this app deserve a cool guy title cause wdym this app has every picture i need, sky picture, cute animals, and etc",5,2026-03-02 14:24:56,imo anyone with this app deserve a cool guy title cause wdym this app has every picture i need sky picture cute animals and etc,0.425,Positive
It's perfect app I never seem before yeah I love this app,5,2026-03-02 14:24:11,its perfect app i never seem before yeah i love this app,0.75,Positive
this app is awsome I can get out fit ideas and meany more,5,2026-03-02 14:23:12,this app is awsome i can get out fit ideas and meany more,0.45,Positive
this app is best like you can make editing and many things but I have a request to the developer please add a download option from your pins so we can use another app so we can edit and upload videos that's it,4,2026-03-02 14:22:40,this app is best like you can make editing and many things but i have a request to the developer please add a download option from your pins so we can use another app so we can edit and upload videos thats it,0.75,Positive
match my asthetic,5,2026-03-02 14:18:47,match my asthetic,0.0,Neutral
nice,5,2026-03-02 14:18:32,nice,0.6,Positive
super,5,2026-03-02 14:18:12,super,0.3333333333333333,Positive
"seriously, pinterest and that game app called 'fun run' needs me as their brand ambassador. i seriously loved this app so much now everyone in my house has these 2 apps and because of me outsider downloaded it too. like i recommend these apps like I'm promoting it.",5,2026-03-02 14:13:50,seriously pinterest and that game app called fun run needs me as their brand ambassador i seriously loved this app so much now everyone in my house has these apps and because of me outsider downloaded it too like i recommend these apps like im promoting it,0.09333333333333331,Positive
ew,5,2026-03-02 14:10:27,ew,0.0,Neutral
nice,5,2026-03-02 14:10:15,nice,0.6,Positive
lots of ideas. thank you♡♡♡,5,2026-03-02 14:05:41,lots of ideas thank you,0.0,Neutral
love This app,5,2026-03-02 14:00:23,love this app,0.5,Positive
"why the hell is my pintrest not working properly from the past many days , it's showing the user not found again and again even though I redownloaded it thrice.",2,2026-03-02 13:53:50,why the hell is my pintrest not working properly from the past many days its showing the user not found again and again even though i redownloaded it thrice,0.08333333333333333,Positive
best app ever,5,2026-03-02 13:52:38,best app ever,1.0,Positive
best App❤️❤️,5,2026-03-02 13:51:58,best app,1.0,Positive
good luck with your friends.,5,2026-03-02 13:49:56,good luck with your friends,0.7,Positive
asthetic girly app love it,5,2026-03-02 13:46:37,asthetic girly app love it,0.5,Positive
Best application,5,2026-03-02 13:22:32,best application,1.0,Positive
really love the app because it can help me find reference easier and also has tons of amazing ideas from other love this app 5 stars⭐,5,2026-03-02 13:20:14,really love the app because it can help me find reference easier and also has tons of amazing ideas from other love this app stars,0.36875,Positive
"use it all the time, only complaint is the ads that come up over what I'm trying to see that cover my recipe. that makes me furious.",5,2026-03-02 13:15:37,use it all the time only complaint is the ads that come up over what im trying to see that cover my recipe that makes me furious,-0.15,Negative
Good 😊😊 ⭐⭐⭐⭐⭐💖,5,2026-03-02 13:10:04,good ,0.7,Positive
simple easy and educative,5,2026-03-02 13:06:53,simple easy and educative,0.21666666666666667,Positive
wow,5,2026-03-02 13:01:51,wow,0.1,Positive
unicorn coloring book pages,5,2026-03-02 12:56:07,unicorn coloring book pages,0.0,Neutral
Army or Blink is a good app for those who make videos without showing their face,5,2026-03-02 12:47:35,army or blink is a good app for those who make videos without showing their face,0.7,Positive
i put my real age and it did not work,1,2026-03-02 12:37:02,i put my real age and it did not work,0.2,Positive
you are created a very nice app,5,2026-03-02 12:36:03,you are created a very nice app,0.78,Positive
good,4,2026-03-02 12:32:43,good,0.7,Positive
Outstanding app!,5,2026-03-02 12:29:47,outstanding app,0.5,Positive
Really good experience,5,2026-03-02 12:18:46,really good experience,0.7,Positive
👍good,5,2026-03-02 12:13:15,good,0.7,Positive
wawa Everything you ask for from it is available in the images.,5,2026-03-02 12:05:42,wawa everything you ask for from it is available in the images,0.4,Positive
"Pintrest used to be my De - stress app but thanks to all the absolute nonsense ads from project makeovers, garden makeover it's ruined the Pintrest experience even after raising the issue on the add centre it pops on my pinterest. Hate using the app now.",1,2026-03-02 12:05:02,pintrest used to be my de stress app but thanks to all the absolute nonsense ads from project makeovers garden makeover its ruined the pintrest experience even after raising the issue on the add centre it pops on my pinterest hate using the app now,-0.13333333333333333,Negative
this is the best app I really love it,5,2026-03-02 12:03:14,this is the best app i really love it,0.75,Positive
awesome app I've never had before 👌,5,2026-03-02 11:47:10,awesome app ive never had before ,1.0,Positive
very informative aap I like this aap very much,4,2026-03-02 11:33:04,very informative aap i like this aap very much,0.23,Positive
So Fun!! 😆😆,5,2026-03-02 11:05:55,so fun ,0.3,Positive
op🤗,5,2026-03-02 10:57:36,op,0.0,Neutral
"""We recently limited the distribution of a Pin related to self-harm from–"" what if I left a bad review about it huh? if I did something wrong then tell me what I did wrong. show me the pin that's getting me in trouble because I'm not even the one creating or distributing it. I am simply liking or saving a pin and being punished for it without any means or way to defend myself. Pinterest do better.",1,2026-03-02 10:57:25,we recently limited the distribution of a pin related to selfharm from what if i left a bad review about it huh if i did something wrong then tell me what i did wrong show me the pin thats getting me in trouble because im not even the one creating or distributing it i am simply liking or saving a pin and being punished for it without any means or way to defend myself pinterest do better,-0.16349206349206347,Negative
it's very helpful,5,2026-03-02 10:56:09,its very helpful,0.2,Positive
I loved it.,5,2026-03-02 10:55:12,i loved it,0.7,Positive
blegh,2,2026-03-02 10:50:33,blegh,0.0,Neutral
king,5,2026-03-02 10:37:58,king,0.0,Neutral
it's the best app ever found.,5,2026-03-02 10:37:31,its the best app ever found,1.0,Positive
Good,4,2026-03-02 10:34:58,good,0.7,Positive
so aesthetic cool cozy can't express in words,5,2026-03-02 10:34:33,so aesthetic cool cozy cant express in words,0.075,Positive
this app makes my expectations very high in everything 😌🙃,5,2026-03-02 10:31:49,this app makes my expectations very high in everything ,0.20800000000000002,Positive
My experience with pinterest is awesome.I find many new ways and recipes and home remedies for myself and my family,5,2026-03-02 10:24:14,my experience with pinterest is awesomei find many new ways and recipes and home remedies for myself and my family,0.3181818181818182,Positive
I love app is uss ful app😌,5,2026-03-02 10:23:08,i love app is uss ful app,0.5,Positive
𝚝𝚑𝚒𝚜 𝚊𝚙𝚙 𝚋𝚊𝚗 𝚖𝚎 𝟸 𝚃𝙸𝙼𝙴𝚂!,1,2026-03-02 10:11:49, ,0.0,Neutral
very fast,5,2026-03-02 10:08:31,very fast,0.26,Positive
failed to log because of the birthdate and giving unnecessary problems,1,2026-03-02 10:07:47,failed to log because of the birthdate and giving unnecessary problems,-0.45,Negative
They pay adds that open the app when you press the closing X.,1,2026-03-02 10:02:54,they pay adds that open the app when you press the closing x,0.0,Neutral
"haven't been on this app in years. but I come back to find that it has been taken over by AI and you can't completely filter all ""AI modified"" images. you just had to deal with them. sickening and disgusting. Get rid of it",1,2026-03-02 09:42:54,havent been on this app in years but i come back to find that it has been taken over by ai and you cant completely filter all ai modified images you just had to deal with them sickening and disgusting get rid of it,-0.45,Negative
Perfect app for ideas and inspiration. I love discovering creative designs and saving them easily.,5,2026-03-02 09:41:24,perfect app for ideas and inspiration i love discovering creative designs and saving them easily,0.6083333333333334,Positive
so difficult,3,2026-03-02 09:38:19,so difficult,-0.5,Negative
Sometimes find it difficult to navigate in this site...,4,2026-03-02 09:36:54,sometimes find it difficult to navigate in this site,-0.5,Negative
"this aap is very good for photos and vedios. if anyone wants good results, they can find them at pinterest. It's such a amazing app 🙌🏻🔥🫀",5,2026-03-02 09:36:38,this aap is very good for photos and vedios if anyone wants good results they can find them at pinterest its such a amazing app ,0.48200000000000004,Positive
Editttt,5,2026-03-02 09:32:58,editttt,0.0,Neutral
I really like Pinterest because it has aesthetic images that touch people's hearts and you can make a lot of things from Pinterest.,5,2026-03-02 09:32:46,i really like pinterest because it has aesthetic images that touch peoples hearts and you can make a lot of things from pinterest,0.2,Positive
i really love this app it's so helpful to me in work,5,2026-03-02 09:31:07,i really love this app its so helpful to me in work,0.5,Positive
one of the best apps a teenager can use!!,5,2026-03-02 09:05:36,one of the best apps a teenager can use,1.0,Positive
This app is very good for use & more features are available in that...,5,2026-03-02 08:59:01,this app is very good for use more features are available in that,0.6033333333333334,Positive
"Inspiring and Fun! Pinterest is amazing for discovering ideas and inspiration. From fashion and recipes to DIY projects and home decor, it’s all in one place. The app is easy to use, visually beautiful, and makes saving and organizing ideas so simple. Perfect for creativity lovers!",5,2026-03-02 08:44:19,inspiring and fun pinterest is amazing for discovering ideas and inspiration from fashion and recipes to diy projects and home decor its all in one place the app is easy to use visually beautiful and makes saving and organizing ideas so simple perfect for creativity lovers,0.5261904761904762,Positive
i love this app sooooooooooooooooo much❤️🌟,5,2026-03-02 08:00:29,i love this app sooooooooooooooooo much,0.35,Positive
I love this app 💗,5,2026-03-02 07:47:12,i love this app ,0.5,Positive
amezing,5,2026-03-02 07:43:43,amezing,0.0,Neutral
this app is best but not opening cleanly many time not working no network problem,1,2026-03-02 07:31:46,this app is best but not opening cleanly many time not working no network problem,0.75,Positive
app is toooooooooo slow,3,2026-03-02 07:25:14,app is toooooooooo slow,-0.30000000000000004,Negative
Not working I don't know what's wrong,1,2026-03-02 07:21:29,not working i dont know whats wrong,-0.5,Negative
this app is so nice but please stop recommending me terrible mouse,4,2026-03-02 06:58:02,this app is so nice but please stop recommending me terrible mouse,-0.2,Negative
I love this for drawing referencing or just scrolling for fun I find myself accidentally spending hours just scrolling,4,2026-03-02 06:47:58,i love this for drawing referencing or just scrolling for fun i find myself accidentally spending hours just scrolling,0.4,Positive
good,3,2026-03-02 06:42:26,good,0.7,Positive
"I've loved pinterest and have used it on mobile and desktop for years. Ads can easily become a problem sometimes, currently they're not the worst (for me). Android doesn't have the same features that Apple does for some reason. Wish there was a type search function when pinning to a board because I have way too many or fixing the ""recommended"" section that comes up first before all your other boards.",4,2026-03-02 06:42:02,ive loved pinterest and have used it on mobile and desktop for years ads can easily become a problem sometimes currently theyre not the worst for me android doesnt have the same features that apple does for some reason wish there was a type search function when pinning to a board because i have way too many or fixing the recommended section that comes up first before all your other boards,0.09479166666666666,Positive
Good app,5,2026-03-02 06:41:20,good app,0.7,Positive
so help full i love it,5,2026-03-02 06:34:42,so help full i love it,0.425,Positive
useful we will get more ideas,5,2026-03-02 06:29:11,useful we will get more ideas,0.4,Positive
nice,5,2026-03-02 06:26:55,nice,0.6,Positive
This app is just wow... It's my favourite one for now and forever ✨,5,2026-03-02 06:24:46,this app is just wow its my favourite one for now and forever ,0.1,Positive
This app is amazing my all time favorite but I Don't know why I can't update this app can someone please tell me how to update this app sooo I just wanted to say this,4,2026-03-02 06:19:53,this app is amazing my all time favorite but i dont know why i cant update this app can someone please tell me how to update this app sooo i just wanted to say this,0.55,Positive
"it's a very useful app ,It would have been even better if the video could also be downloaded directly from this app.",5,2026-03-02 06:15:44,its a very useful app it would have been even better if the video could also be downloaded directly from this app,0.33,Positive
🙏,5,2026-03-02 05:54:56,,0.0,Neutral
It's good for creating and finding aesthetic images & clips but I would be more more great if you add delete pin option in front bcoz those images who is no longer in use remain there n it takes time in scrolling too,4,2026-03-02 05:49:08,its good for creating and finding aesthetic images clips but i would be more more great if you add delete pin option in front bcoz those images who is no longer in use remain there n it takes time in scrolling too,0.625,Positive
"I love this app...but since past few days, it's acting up. Everytime I open the app it just keeps on loading and nothing appears on the screen.",4,2026-03-02 05:45:44,i love this appbut since past few days its acting up everytime i open the app it just keeps on loading and nothing appears on the screen,0.009999999999999998,Positive
I like this app,4,2026-03-02 05:45:22,i like this app,0.0,Neutral
Good,5,2026-03-02 05:36:04,good,0.7,Positive
amazing such a good app to find ideas,5,2026-03-02 05:19:30,amazing such a good app to find ideas,0.43333333333333335,Positive
Currently very glitchy. 3 stars because I love Pinterest for finding inspiration for creativity and mood boards but it is Ad after Ad these days and a lot of AI.,3,2026-03-02 05:17:40,currently very glitchy stars because i love pinterest for finding inspiration for creativity and mood boards but it is ad after ad these days and a lot of ai,0.35,Positive
good,5,2026-03-02 05:01:39,good,0.7,Positive
this app is the one for your art ideas and the best app in my or your device,4,2026-03-02 05:01:31,this app is the one for your art ideas and the best app in my or your device,1.0,Positive
I Love Pinterest,5,2026-03-02 04:59:37,i love pinterest,0.5,Positive
everything is perfect 😊,5,2026-03-02 04:56:27,everything is perfect ,1.0,Positive
"i am not able to send the message to my friend each time when i tap to send the message follows caution shown "" Sorry for that, Problem at our end"" recently I report the problem at pintrest help section but no action taken till now.",1,2026-03-02 04:56:23,i am not able to send the message to my friend each time when i tap to send the message follows caution shown sorry for that problem at our end recently i report the problem at pintrest help section but no action taken till now,-0.2,Negative
its just good because it gets along with ur aesthetic,5,2026-03-02 04:46:39,its just good because it gets along with ur aesthetic,0.7,Positive
The app is really good but half of the times it doesn't load. Like i have full network and stuff but it just doesn't start. pls fix this.,1,2026-03-02 04:37:08,the app is really good but half of the times it doesnt load like i have full network and stuff but it just doesnt start pls fix this,0.29444444444444445,Positive
butch much church Busch Busch Busch big,5,2026-03-02 04:36:04,butch much church busch busch busch big,0.1,Positive
very nice 👍,5,2026-03-02 04:31:30,very nice ,0.78,Positive
Social media app,4,2026-03-02 04:29:13,social media app,0.03333333333333333,Positive
bahut hi Achcha application hai aur usse free AI videos Mil Jata Hai,1,2026-03-02 04:23:02,bahut hi achcha application hai aur usse free ai videos mil jata hai,0.4,Positive
helps eveyday,5,2026-03-02 04:17:24,helps eveyday,0.0,Neutral
🫶🏼,5,2026-03-02 04:07:06,,0.0,Neutral
this is a perfect app. I love it. lots of inspiring ideas. I recommend this app for everyone. if you can please make a way you remove the things we save when we don't want them. 😅🤧,4,2026-03-02 04:04:31,this is a perfect app i love it lots of inspiring ideas i recommend this app for everyone if you can please make a way you remove the things we save when we dont want them ,0.6666666666666666,Positive
it's just a good aap,5,2026-03-02 04:03:13,its just a good aap,0.7,Positive
"I am loving this app, I found out about it on a school Chromebook like 3 years ago when my friend showed it to me. I then got it on my phone to try and find a wallpaper and have been using it ever since. one thing I don't like is that it says the pin was made with AI when it was not. other than that, I think it's an amazing app!",5,2026-03-02 03:47:56,i am loving this app i found out about it on a school chromebook like years ago when my friend showed it to me i then got it on my phone to try and find a wallpaper and have been using it ever since one thing i dont like is that it says the pin was made with ai when it was not other than that i think its an amazing app,0.4208333333333334,Positive
Fabulous,5,2026-03-02 03:44:43,fabulous,0.4,Positive
the best app very app,5,2026-03-02 03:23:47,the best app very app,0.6,Positive
helpful,5,2026-03-02 03:23:10,helpful,0.0,Neutral
My type of videos helpful for studies and best for my youtube shorts,5,2026-03-02 03:22:42,my type of videos helpful for studies and best for my youtube shorts,1.0,Positive
I love this app 'cause it has everything for drawing and it does contain anime's things that are literally so good and this helps me decide what to draw.❤️,5,2026-03-02 03:17:31,i love this app cause it has everything for drawing and it does contain animes things that are literally so good and this helps me decide what to draw,0.6,Positive
this app give me ideas of what to were,5,2026-03-02 03:08:23,this app give me ideas of what to were,0.0,Neutral
the app is so good and it has a lot of pictures I love it,5,2026-03-02 03:04:49,the app is so good and it has a lot of pictures i love it,0.6,Positive
"Pinterest is an inspiring platform where I can discover creative ideas, from fashion and quotes to study tips and room decor. The visual layout makes it easy to explore and save content into boards. It is perfect for finding inspiration and planning projects. Overall, Pinterest is motivating and aesthetically pleasing.",5,2026-03-02 03:04:03,pinterest is an inspiring platform where i can discover creative ideas from fashion and quotes to study tips and room decor the visual layout makes it easy to explore and save content into boards it is perfect for finding inspiration and planning projects overall pinterest is motivating and aesthetically pleasing,0.4055555555555556,Positive
"really good appp to find in spo, and more:)",5,2026-03-02 02:50:06,really good appp to find in spo and more,0.6,Positive
good luck with,5,2026-03-02 02:49:38,good luck with,0.7,Positive
bestttttttt......,5,2026-03-02 02:44:25,bestttttttt,0.0,Neutral
not working properly all ai images and only getting hang,1,2026-03-02 02:28:05,not working properly all ai images and only getting hang,0.0,Neutral
good 👍,4,2026-03-02 02:24:36,good ,0.7,Positive
✨✨✨,5,2026-03-02 02:07:34,,0.0,Neutral
"Whether it is a presentation of new ideas or new blogs, Pinterest ALWAYS stays at the top. Tq",5,2026-03-02 02:07:15,whether it is a presentation of new ideas or new blogs pinterest always stays at the top tq,0.25757575757575757,Positive
